{
  "schemaVersion": "lythaus-authenticity-dataset-registry-v2",
  "accessedAt": "2026-08-09",
  "policy": {
    "normalLythausUserContentTraining": "PROHIBITED",
    "unclearRights": "UNCLEAR",
    "largeMaterialisation": "BOUNDED_EXTERNAL_CACHE_ONLY",
    "unclearRightsAction": "DO_NOT_TRAIN",
    "commercialUseRequiresOwnerAndLegalApproval": true
  },
  "classificationValues": [
    "APPROVED_FOR_COMMERCIAL_TRAINING",
    "APPROVED_FOR_EVALUATION_ONLY",
    "APPROVED_WITH_CONDITIONS",
    "REQUIRES_PERMISSION",
    "PROHIBITED",
    "UNCLEAR"
  ],
  "rightsClassValues": [
    "CLASS_A_COMMERCIAL_TRAINING",
    "CLASS_B_EVALUATION_ONLY",
    "CLASS_C_LYTHAUS_OWNED"
  ],
  "datasets": [
    {
      "id": "open-images-v7",
      "name": "Open Images V7",
      "classification": "APPROVED_WITH_CONDITIONS",
      "rightsClass": "CLASS_B_EVALUATION_ONLY",
      "trainingGate": "DO_NOT_TRAIN",
      "evaluationGate": "CONDITIONAL",
      "distillationGate": "DO_NOT_TRAIN",
      "source": "https://storage.googleapis.com/openimages/web/index.html",
      "maintainer": "Google / Open Images project",
      "licence": "Annotations Apache-2.0; image rights vary and are listed per image",
      "commercialUse": "APPROVED_WITH_CONDITIONS",
      "researchUse": "APPROVED_WITH_CONDITIONS",
      "trainingAllowed": "PER_IMAGE_REVIEW_REQUIRED",
      "distillationAllowed": "PER_IMAGE_REVIEW_REQUIRED",
      "redistributionAllowed": "PER_IMAGE_REVIEW_REQUIRED",
      "modificationAllowed": "PER_IMAGE_REVIEW_REQUIRED",
      "attributionRequirements": "Per-image and dataset attribution",
      "datasetSize": "~9 million image URLs plus annotations",
      "mediaType": "photographs and other web images",
      "labels": "objects, boxes, image-level labels",
      "generatorCoverage": "not a synthetic-generator corpus",
      "knownLimitations": "Image licence status must be verified per item; URLs are not a redistribution right",
      "recommendation": "Curated evaluation/hard-negative source only until per-item audit"
    },
    {
      "id": "coco",
      "name": "COCO",
      "classification": "UNCLEAR",
      "rightsClass": "CLASS_B_EVALUATION_ONLY",
      "trainingGate": "DO_NOT_TRAIN",
      "evaluationGate": "CONDITIONAL",
      "distillationGate": "DO_NOT_TRAIN",
      "source": "https://cocodataset.org/#termsofuse",
      "maintainer": "COCO Consortium",
      "licence": "Dataset terms and source-image rights require current review",
      "commercialUse": "UNCLEAR",
      "researchUse": "APPROVED_WITH_CONDITIONS",
      "trainingAllowed": "UNKNOWN",
      "distillationAllowed": "UNKNOWN",
      "redistributionAllowed": "UNKNOWN",
      "modificationAllowed": "UNKNOWN",
      "attributionRequirements": "Dataset citation and source-image terms",
      "datasetSize": "large; do not materialise in WP002",
      "mediaType": "photographs and captions",
      "labels": "detection, segmentation, captions",
      "generatorCoverage": "none",
      "knownLimitations": "Source-image rights and privacy vary",
      "recommendation": "Evaluation candidate pending legal confirmation"
    },
    {
      "id": "unsplash",
      "name": "Unsplash licensed imagery",
      "classification": "APPROVED_WITH_CONDITIONS",
      "rightsClass": "CLASS_B_EVALUATION_ONLY",
      "trainingGate": "DO_NOT_TRAIN",
      "evaluationGate": "DENY",
      "distillationGate": "DO_NOT_TRAIN",
      "source": "https://unsplash.com/license",
      "maintainer": "Unsplash contributors and Unsplash",
      "licence": "Unsplash licence; prohibits compiling imagery to replicate a similar or competing service",
      "commercialUse": "APPROVED_WITH_CONDITIONS",
      "researchUse": "APPROVED_WITH_CONDITIONS",
      "trainingAllowed": "LEGAL_REVIEW_REQUIRED",
      "distillationAllowed": "LEGAL_REVIEW_REQUIRED",
      "redistributionAllowed": "RESTRICTED",
      "modificationAllowed": "APPROVED_WITH_CONDITIONS",
      "attributionRequirements": "Not generally required; attribution recommended",
      "datasetSize": "large and API/access dependent",
      "mediaType": "photographs",
      "labels": "limited metadata",
      "generatorCoverage": "camera-native candidate only",
      "knownLimitations": "Model releases, artwork, trademarks, and anti-compilation terms",
      "recommendation": "Do not use as a bulk corpus without written legal approval"
    },
    {
      "id": "unsplash-dataset-lite",
      "name": "Unsplash Dataset Lite",
      "classification": "APPROVED_WITH_CONDITIONS",
      "rightsClass": "CLASS_B_EVALUATION_ONLY",
      "trainingGate": "DO_NOT_TRAIN",
      "evaluationGate": "ALLOW",
      "distillationGate": "DO_NOT_TRAIN",
      "source": "https://github.com/unsplash/datasets",
      "maintainer": "Unsplash",
      "licence": "Official Dataset Lite terms; commercial/non-commercial dataset usage is stated, while image redistribution and downstream model/API rights require separate review",
      "licenceUrl": "https://github.com/unsplash/datasets/blob/master/TERMS.md",
      "termsSnapshot": {
        "retrievedAt": "2026-08-09T21:00:00.000Z",
        "sourceUrl": "https://raw.githubusercontent.com/unsplash/datasets/master/TERMS.md",
        "sha256": "79bec96fe07431e1c40efcdf9f9753da24338a3cb97d7d22ac29dc830e3e2437",
        "storageReference": "external:C:/Users/kylee/Projects/Lythaus-data/authenticity-wp003/terms/unsplash-dataset-terms.md"
      },
      "commercialUse": "CONDITIONAL; do not infer commercial model deployment rights",
      "researchUse": "ALLOW",
      "trainingAllowed": "DO_NOT_TRAIN_PENDING_RIGHTS_REVIEW",
      "distillationAllowed": "DO_NOT_TRAIN",
      "redistributionAllowed": "PROHIBITED_UNLESS_TERMS_ALLOW",
      "modificationAllowed": "CONDITIONAL_FOR_RESEARCH",
      "attributionRequirements": "Dataset attribution and source metadata preservation",
      "datasetSize": "~25,000 images; bounded WP003 subset",
      "mediaType": "photographs and dataset metadata",
      "labels": "keywords, camera and image metadata where present",
      "generatorCoverage": "camera-native candidate only",
      "knownLimitations": "Official terms prohibit image redistribution; commercial training and future API rights need explicit owner/legal review",
      "archiveSha256": "aa0fcbb859040ed64e93817d1d878d0c6f861763283261ba1a6aa5d8d4af6aec6",
      "archiveSizeBytes": 320024071,
      "materialisedSampleCount": 80,
      "materialisedDescendantCount": 720,
      "materialisationStatus": "VERIFIED_EXTERNAL_EVALUATION_SLICE",
      "recommendation": "Materialise for evaluation and provenance work; do not train or distil until written rights analysis is complete"
    },
    {
      "id": "wikimedia-commons-curated",
      "name": "Wikimedia Commons curated media",
      "classification": "APPROVED_WITH_CONDITIONS",
      "rightsClass": "CLASS_B_EVALUATION_ONLY",
      "trainingGate": "DO_NOT_TRAIN",
      "evaluationGate": "CONDITIONAL",
      "distillationGate": "DO_NOT_TRAIN",
      "source": "https://commons.wikimedia.org/wiki/Commons:Reusing_content_outside_Wikimedia",
      "maintainer": "Wikimedia Commons contributors",
      "licence": "Per-file public-domain or Creative Commons and other declared licences",
      "commercialUse": "APPROVED_WITH_CONDITIONS",
      "researchUse": "APPROVED_WITH_CONDITIONS",
      "trainingAllowed": "PER_FILE_REVIEW_REQUIRED",
      "distillationAllowed": "PER_FILE_REVIEW_REQUIRED",
      "redistributionAllowed": "PER_FILE_REVIEW_REQUIRED",
      "modificationAllowed": "PER_FILE_REVIEW_REQUIRED",
      "attributionRequirements": "Per-file attribution/share-alike where applicable",
      "datasetSize": "large; use a small manifest",
      "mediaType": "photographs, scans, artwork, screenshots, diagrams",
      "labels": "community categories and metadata",
      "generatorCoverage": "hard negatives and camera-native candidates",
      "knownLimitations": "Heterogeneous licences, consent, privacy, and provenance",
      "recommendation": "Good curated evaluation source after per-file audit"
    },
    {
      "id": "raise-1k",
      "name": "RAISE-1k",
      "classification": "REQUIRES_PERMISSION",
      "rightsClass": "CLASS_B_EVALUATION_ONLY",
      "trainingGate": "DO_NOT_TRAIN",
      "evaluationGate": "CONDITIONAL",
      "distillationGate": "DO_NOT_TRAIN",
      "source": "https://loki.disi.unitn.it/RAISE/index.php",
      "maintainer": "RAISE dataset maintainers",
      "licence": "Current redistribution and commercial terms not verified",
      "commercialUse": "REQUIRES_PERMISSION",
      "researchUse": "APPROVED_WITH_CONDITIONS",
      "trainingAllowed": "REQUIRES_PERMISSION",
      "distillationAllowed": "REQUIRES_PERMISSION",
      "redistributionAllowed": "UNKNOWN",
      "modificationAllowed": "UNKNOWN",
      "attributionRequirements": "Dataset citation if approved",
      "datasetSize": "~1,000 high-resolution photographs",
      "mediaType": "camera photographs",
      "labels": "camera/photo metadata where available",
      "generatorCoverage": "none",
      "knownLimitations": "Licence and regional/subject balance require confirmation",
      "recommendation": "Evaluation-only candidate until written terms are verified"
    },
    {
      "id": "mit-adobe-fivek",
      "name": "MIT-Adobe FiveK",
      "classification": "REQUIRES_PERMISSION",
      "rightsClass": "CLASS_B_EVALUATION_ONLY",
      "trainingGate": "DO_NOT_TRAIN",
      "evaluationGate": "CONDITIONAL",
      "distillationGate": "DO_NOT_TRAIN",
      "source": "https://data.csail.mit.edu/graphics/fivek/",
      "maintainer": "MIT / Adobe research collaboration",
      "licence": "Academic dataset terms require current review",
      "commercialUse": "REQUIRES_PERMISSION",
      "researchUse": "APPROVED_WITH_CONDITIONS",
      "trainingAllowed": "REQUIRES_PERMISSION",
      "distillationAllowed": "REQUIRES_PERMISSION",
      "redistributionAllowed": "REQUIRES_PERMISSION",